{
  "id": "MEAS-001",
  "type": "measurement",
  "schema_version": "0.2.0",
  "record_version": "0.1.0",
  "created_at": "2025-12-24T14:35:59.420590+00:00",
  "scope": [
    "nahe der Erdoberfläche",
    "Luftwiderstand vernachlässigt"
  ],
  "provenance": {
    "source": "docs/architecture",
    "driver": "measurement_driver",
    "notes": "Example artifact."
  },
  "links": [
    {
      "rel": "derived_from",
      "target": "C-001"
    }
  ],
  "payload": {
    "quantity": "Position",
    "procedure": "Zeitstempel t_i und Position x_i via Kamera/Lichtschranke erfassen",
    "instrument": "Kamera oder Lichtschranke",
    "unit": "m",
    "dimension": "L",
    "sampling": {
      "rate_hz": 120.0,
      "n_samples": 200
    },
    "uncertainty": {
      "statistical": "Messrauschen pro Sample",
      "systematic": "Kalibrierung/Alignment"
    }
  }
}