{
  "id": "EVID-001",
  "type": "evidence",
  "schema_version": "0.2.0",
  "record_version": "0.1.0",
  "created_at": "2025-12-24T14:35:59.420590+00:00",
  "scope": [
    "nahe der Erdoberfläche",
    "Luftwiderstand vernachlässigt"
  ],
  "provenance": {
    "source": "docs/architecture",
    "driver": "evidence_aggregator",
    "notes": "Example artifact."
  },
  "links": [
    {
      "rel": "supports",
      "target": "C-001"
    },
    {
      "rel": "derived_from",
      "target": "INF-001"
    }
  ],
  "payload": {
    "evidence_type": "empirical",
    "supports_claim_id": "C-001",
    "method_summary": "Messreihe (t_i, x_i) → a_i; geringe Varianz über i im Scope",
    "quality_notes": "Kalibrierung/Einheiten beachten; Diskretisierung",
    "uncertainty_summary": "statistisch + systematisch",
    "scope_alignment": "match"
  }
}